<?xml version="1.0" encoding="UTF-8" standalone="yes"?>
<!--W3C Schema generated by XMLSpy v2005 sp2 U (http://www.altova.com)-->
<xs:schema xmlns:xs="http://www.w3.org/2001/XMLSchema" elementFormDefault="qualified">
	<xs:element name="File">
		<xs:complexType>
			<xs:element ref="screen" />
			<xs:sequence>
				<xs:element ref="fields"/>
			</xs:sequence>
			<xs:attribute name="name" use="required">
				<xs:simpleType>
					<xs:restriction base="xs:string">
					</xs:restriction>
				</xs:simpleType>
			</xs:attribute>
			<xs:attribute name="number" use="required">
				<xs:simpleType>
					<xs:restriction base="xs:decimal">
					</xs:restriction>
				</xs:simpleType>
			</xs:attribute>
			<xs:attribute name="global" use="required">
				<xs:simpleType>
					<xs:restriction base="xs:string">
					</xs:restriction>
				</xs:simpleType>
			</xs:attribute>
			<xs:attribute name="mdo" use="required">
				<xs:simpleType>
					<xs:restriction base="xs:string">
					</xs:restriction>
				</xs:simpleType>					
			</xs:attribute>
		</xs:complexType>
	</xs:element>
	<xs:element name="VistaFiles">
		<xs:complexType>
			<xs:sequence>
				<xs:element ref="File" maxOccurs="unbounded"/>
			</xs:sequence>
		</xs:complexType>
	</xs:element>
	<xs:element name="field">
		<xs:complexType>
			<xs:sequence>
				<xs:element ref="vista"/>
				<xs:element ref="mdo"/>
				<xs:element ref="mapping" minOccurs="0"/>
			</xs:sequence>
			<xs:attribute name="pos" use="required">
				<xs:simpleType>
					<xs:restriction base="xs:string">
					</xs:restriction>
				</xs:simpleType>
			</xs:attribute>
		</xs:complexType>
	</xs:element>
	<xs:element name="fields">
		<xs:complexType>
			<xs:sequence>
				<xs:element ref="field" maxOccurs="unbounded"/>
			</xs:sequence>
		</xs:complexType>
	</xs:element>
	<xs:element name="map">
		<xs:complexType>
			<xs:attribute name="code" use="required">
				<xs:simpleType>
					<xs:restriction base="xs:string">
					</xs:restriction>
				</xs:simpleType>
			</xs:attribute>
			<xs:attribute name="value" use="required">
				<xs:simpleType>
					<xs:restriction base="xs:string">
					</xs:restriction>
				</xs:simpleType>
			</xs:attribute>
		</xs:complexType>
	</xs:element>
	<xs:element name="mapping">
		<xs:complexType>
			<xs:sequence>
				<xs:element ref="map" minOccurs="0" maxOccurs="unbounded"/>
			</xs:sequence>
			<xs:attribute name="type" use="required">
				<xs:simpleType>
					<xs:restriction base="xs:string">
						<xs:enumeration value="decode"/>
						<xs:enumeration value="pointer"/>
					</xs:restriction>
				</xs:simpleType>
			</xs:attribute>
			<xs:attribute name="file">
				<xs:simpleType>
					<xs:restriction base="xs:decimal">
					</xs:restriction>
				</xs:simpleType>
			</xs:attribute>
		</xs:complexType>
	</xs:element>
	<xs:element name="mdo">
		<xs:complexType>
			<xs:attribute name="name" use="required">
				<xs:simpleType>
					<xs:restriction base="xs:string">
					</xs:restriction>
				</xs:simpleType>
			</xs:attribute>
			<xs:attribute name="type" use="required">
				<xs:simpleType>
					<xs:restriction base="xs:string">
						<xs:enumeration value="kvp"/>
						<xs:enumeration value="string"/>
					</xs:restriction>
				</xs:simpleType>
			</xs:attribute>
		</xs:complexType>
	</xs:element>
	<xs:element name="vista">
		<xs:complexType>
			<xs:attribute name="name" use="required">
				<xs:simpleType>
					<xs:restriction base="xs:string">
					</xs:restriction>
				</xs:simpleType>
			</xs:attribute>
			<xs:attribute name="number" use="required">
				<xs:simpleType>
					<xs:restriction base="xs:string">
					</xs:restriction>
				</xs:simpleType>
			</xs:attribute>
			<xs:attribute name="node" use="required">
				<xs:simpleType>
					<xs:restriction base="xs:string">
					</xs:restriction>
				</xs:simpleType>
			</xs:attribute>
			<xs:attribute name="piece" type="xs:string" use="required"/>
		</xs:complexType>
	</xs:element>
</xs:schema>
